{
  "schema": "pvs-classical-physics-values/1",
  "oscillator": {
    "mass_kg": 2.0,
    "spring_constant_n_m": 8.0,
    "amplitude_m": 0.25,
    "time_s": [
      0.0,
      0.5,
      1.0,
      2.0,
      3.0
    ],
    "position_m": [
      0.25,
      0.13507557646703494,
      -0.1040367091367856,
      -0.16341090521590299,
      0.2400425716625915
    ],
    "velocity_m_s": [
      0.0,
      -0.42073549240394825,
      -0.45464871341284085,
      0.3784012476539641,
      0.13970774909946293
    ],
    "total_energy_j": [
      0.25,
      0.25,
      0.25,
      0.25,
      0.25
    ]
  },
  "heat": {
    "length_m": 1.0,
    "diffusivity_m2_s": 0.1,
    "initial_amplitude_k": 10.0,
    "time_s": [
      0.0,
      0.5,
      2.0
    ],
    "position_m": [
      0.0,
      0.25,
      0.5,
      0.75,
      1.0
    ],
    "temperature_excess_k": [
      [
        0.0,
        7.0710678118654755,
        10.0,
        7.0710678118654755,
        0.0
      ],
      [
        0.0,
        4.3168729356644135,
        6.104980252657971,
        4.3168729356644135,
        0.0
      ],
      [
        0.0,
        0.9822500422758143,
        1.3891113314280024,
        0.9822500422758143,
        0.0
      ]
    ]
  },
  "kepler": {
    "gravitational_parameter_m3_s2": 1.0,
    "radius_m": [
      1.0,
      4.0,
      9.0
    ],
    "circular_speed_m_s": [
      1.0,
      0.5,
      0.3333333333333333
    ],
    "orbital_period_s": [
      6.283185307179586,
      50.26548245743669,
      169.64600329384882
    ]
  }
}
